question,options,answer,category,difficulty,explication
"Quelle commande Composer permet d'examiner pourquoi une version spécifique d'un package (par ex: `drupal/core-dev 10.1.5`) est installée et quels autres packages en dépendent ?",1) composer show drupal/core-dev | 2) composer depends drupal/core-dev | 3) composer why drupal/core-dev | 4) composer prohibits drupal/core-dev,3,"1.3 Managing dependencies using Composer",Difficile,"La commande `composer why` (ou `composer depends` qui est un alias) est l'outil de diagnostic qui parcourt l'arbre des dépendances pour expliquer pourquoi un package donné est présent dans votre projet. `prohibits` fait l'inverse (explique pourquoi un package ne peut pas être installé), et `show` affiche des informations sur le package sans expliquer la chaîne de dépendance."
"Vous devez créer une route qui n'est accessible que si un module spécifique, disons `my_feature`, est activé. Quelle est la bonne syntaxe à utiliser dans votre fichier `mon_module.routing.yml` ?",1) `requirements: _module_exists: 'my_feature'` | 2) `requirements: _module: 'my_feature'` | 3) `requirements: _custom_access: '\Drupal\my_module\Access\MyFeatureAccessCheck'` | 4) `options: _module_dependency: 'my_feature'`,1,"2.1 Routing system and Menu API",Difficile,"Le système de routage de Drupal fournit un vérificateur d'accès prêt à l'emploi, `_module_exists`, qui permet de conditionner l'accès à une route à l'activation d'un ou plusieurs modules. C'est la méthode la plus simple et la plus déclarative pour ce besoin. Créer une classe d'accès personnalisée (Option 3) serait excessif pour ce cas simple."
"Dans un `hook_form_alter`, vous voulez ajouter une fonction de validation qui s'exécute *avant* toutes les autres validations de base du formulaire. Comment devez-vous l'ajouter ?","1) `$form['#validate'][] = 'my_custom_validation';` | 2) `array_unshift($form['#validate'], 'my_custom_validation');` | 3) `$form['#after_build'][] = 'my_custom_validation';` | 4) `$form['#validate_early'][] = 'my_custom_validation';`",2,"2.2 Build, alter, validate and submit forms using Form API",Expert,"Les validateurs de formulaire sont exécutés dans l'ordre où ils apparaissent dans le tableau `$form['#validate']`. Pour qu'une validation s'exécute en premier, il faut l'ajouter au début du tableau en utilisant `array_unshift()`. L'ajout simple avec `[]` (Option 1) la placerait à la fin. `#after_build` est pour la modification du rendu, pas la validation."
"Vous créez un champ calculé qui dépend de la valeur d'un autre champ sur la même entité. Comment forcer le recalcul de votre champ lorsque le champ source est modifié ?",1) En implémentant `hook_entity_presave` et en appelant `$entity->get('mon_champ_calcule')->recompute()` | 2) La dépendance est automatique si les deux champs sont sur la même entité. | 3) En utilisant la méthode `setValue()` sur le champ calculé dans un `hook_entity_update`. | 4) En déclarant la dépendance dans l'annotation `@FieldType` du champ calculé.,1,"2.3 Interact with the entity system using Entity API",Expert,"Le recalcul des champs calculés n'est pas automatique lors de la mise à jour d'une entité. Le moment approprié pour déclencher ce recalcul est juste avant la sauvegarde, via `hook_entity_presave`. Dans ce hook, on peut vérifier si le champ source a changé et, si c'est le cas, forcer le recalcul. La méthode `recompute()` n'existe pas, mais on peut simplement effacer la valeur existante (`$entity->get('mon_champ_calcule')->setValue(NULL)`) pour que la méthode `computeValue()` soit appelée à nouveau."
"Un collègue se plaint que son `hook_node_view_alter` ne semble pas fonctionner. Le cache a été vidé. Quel outil de débogage et quelle méthode utiliseriez-vous pour vérifier si Drupal découvre même son implémentation de hook ?",1) Activer le module Devel et vérifier la page `/devel/hooks`. | 2) Placer un point d'arrêt Xdebug dans `ModuleHandler::invokeAll()` et inspecter la variable `$implementations`. | 3) Utiliser Drush : `drush ev """"print_r(\Drupal::moduleHandler()->getImplementations('node_view_alter'));""""` | 4) Toutes ces réponses sont des méthodes valides pour diagnostiquer le problème.,4,"3.1 Debug code",Difficile,"Les trois méthodes sont des approches valides et professionnelles pour ce problème. L'option 1 (Devel) est une approche visuelle rapide. L'option 2 (Xdebug) est la plus puissante pour une analyse en temps réel de l'exécution du code. L'option 3 (Drush) est idéale pour une vérification rapide en ligne de commande sans interface graphique."
"Dans un template Twig, vous avez une variable `complex_array`. Quelle syntaxe permet d'afficher son contenu de manière détaillée pour le débogage, à condition que le module Devel et l'intégration Kint soient activés ?",1) `{{ dump(complex_array) }}` | 2) `{% debug complex_array %}` | 3) `{{ kint(complex_array) }}` | 4) `{{ devel_dump(complex_array) }}`,3,"4.2 Work with Twig templates and syntax",Difficile,"Lorsque le module Devel est configuré pour utiliser Kint, il expose une fonction Twig `kint()`. C'est la méthode recommandée pour obtenir un affichage riche et interactif des variables. `dump()` est une fonction de base de Twig, moins détaillée. Les autres options n'existent pas par défaut."
"Un bloc personnalisé affichant une information qui dépend du rôle de l'utilisateur est mis en cache de manière incorrecte. Le code est `return ['#markup' => $output, '#cache' => ['tags' => ['user:' . $user->id()]]];`. Qu'est-ce qui manque pour assurer une variation correcte du cache ?",1) `'max-age' => 0` | 2) `'contexts' => ['user.roles']` | 3) `'contexts' => ['url.path']` | 4) Une invalidation de tag personnalisée.,2,"5.3 Implement Drupal caching strategies using Cache API",Expert,"Les `tags` servent à l'invalidation (QUAND vider le cache), tandis que les `contexts` servent à la variation (POUR QUOI créer une version différente du cache). Ici, le contenu varie en fonction des rôles de l'utilisateur. Le contexte de cache correct est donc `user.roles`. L'utilisation du tag `user:UID` invalidera le cache si l'utilisateur est modifié, mais ne créera pas de versions différentes pour un admin et un utilisateur anonyme."
"Votre module expose un endpoint REST qui renvoie des données sensibles. Quelle est la meilleure façon de restreindre l'accès à ce endpoint uniquement aux utilisateurs ayant la permission `access sensitive data` ?","1) Dans le contrôleur, vérifier avec `\Drupal::currentUser()->hasPermission('access sensitive data');` | 2) Dans `mon_module.routing.yml`, ajouter `requirements: _access: 'TRUE'` | 3) Dans `mon_module.routing.yml`, ajouter `requirements: _permission: 'access sensitive data'` | 4) Dans `mon_module.permissions.yml`, lier la permission à la route.",3,"6.3 Implement Drupal core security mechanisms",Difficile,"La méthode standard, la plus propre et la plus performante, consiste à définir la permission requise directement au niveau de la route dans le fichier `*.routing.yml`. Le système de routage de Drupal se chargera de vérifier la permission avant même que le code du contrôleur ne soit exécuté. Placer la vérification dans le contrôleur (Option 1) fonctionne mais est moins efficace et mélange la logique de routage avec la logique métier."
"Quel est le problème de sécurité principal dans le code de ce contrôleur de formulaire ?
<code>
public function submitForm(array &$form, FormStateInterface $form_state) {
  $url = $form_state->getValue('redirect_url');
  $response = new RedirectResponse($url);
  $response->send();
}
</code>",1) Injection de dépendances incorrecte. | 2) Risque de redirection ouverte (Open Redirect). | 3) Absence de protection CSRF. | 4) Mauvaise utilisation du service `messenger`. ,2,"6.2 Analyze and resolve security issues arising from custom code",Expert,"Ce code est vulnérable à une 'Open Redirect'. Il récupère une URL depuis les données du formulaire et redirige l'utilisateur sans aucune validation. Un attaquant pourrait créer un lien vers ce formulaire en passant une URL malveillante dans le champ `redirect_url`, faisant croire à l'utilisateur qu'il est sur un site de confiance alors qu'il est redirigé vers un site de phishing. La solution est de valider l'URL avec `UrlHelper::isExternal()` ou de s'assurer qu'elle est interne au site."
"Vous écrivez un patch pour un module contribué. Selon les standards de codage Drupal, comment devrait être formatée la ligne suivante ?
<code>`if($items>0){`</code>",1) <code>`if ( $items > 0 ) {`</code> | 2) <code>`if ($items > 0) {`</code> | 3) <code>`if($items > 0){`</code> | 4) <code>`if ($items>0) {`</code>,2,"7.2 Write code using Drupal coding standards",Facile,"Les standards de codage de Drupal sont très stricts sur l'espacement pour la lisibilité. La règle pour les structures de contrôle (`if`, `foreach`, etc.) est : un espace après le mot-clé (`if`), aucun espace après la parenthèse ouvrante, aucun espace avant la parenthèse fermante, et un espace avant l'accolade ouvrante."
"Vous créez un plugin de type `MyCustomPlugin`. Ce plugin a besoin d'accéder au service `current_user`. Quelle est l'implémentation correcte pour injecter ce service en respectant les standards de Drupal 11 ?","1) <code>class MyPlugin extends MyPluginBase { public function __construct(...) { parent::__construct(...); $this->currentUser = \Drupal::service('current_user'); } }</code> | 2) <code>class MyPlugin extends MyPluginBase implements ContainerFactoryPluginInterface { public function __construct(..., protected AccountInterface $currentUser) { ... } public static function create(ContainerInterface $container, ...) { return new static(..., $container->get('current_user')); } }</code> | 3) <code>class MyPlugin extends MyPluginBase { public function build() { $user = \Drupal::currentUser(); } }</code> | 4) <code>class MyPlugin extends MyPluginBase { protected $currentUser; public function __construct() { $this->currentUser = \Drupal::service('current_user'); } }</code>"",2,"2.4 Core APIs",Difficile,"La méthode correcte pour les plugins est d'implémenter `ContainerFactoryPluginInterface`. Cela oblige à créer une méthode `create()` statique qui reçoit le conteneur de services. C'est cette méthode qui est responsable de récupérer les services requis et de les passer au constructeur. Cette approche garantit que le plugin est correctement instancié par Drupal avec ses dépendances, le rendant découplé et testable."